{
  "$schema": "../../schemas/knowledge_entity.schema.json",
  "id": "knowledge.useful_god.thien_tai",
  "domain": "UsefulGod",
  "key": "Thiên Tài",
  "entity_type": "role",
  "title": "Thiên Tài — kênh vận hành nguồn cơ động",
  "meaning": "Thiên Tài là vai trò tài bất thường: nguồn đến-đi nhanh, cơ hội, rủi ro. Không phải nghĩa một can và không hứa thắng cược. Khi làm Dụng thần, hướng là xoay nguồn linh hoạt. Khi thuộc Hỷ, hỗ trợ thanh khoản theo Dụng. Khi thuộc Kỵ, cùng cơ động thành trượt nguồn, không giữ đáy, hút sức.",
  "positive_meaning": "Là Dụng thần: xoay vòng, chớp cửa sổ, không đóng băng nguồn. Là Hỷ thần: hỗ trợ thanh khoản — không thay Dụng.",
  "negative_meaning": "Là Kỵ thần hoặc dùng quá mức: trượt vốn, theo cơ hội không bờ. Gia cố Thiên Tài khi cần ấn/ổn định làm lệch.",
  "applications": {
    "career": "Hợp môi trường dự án ngắn, cửa sổ cơ hội, việc không lặp. Phong cách: xoay. Không suy ra nghề đầu cơ.",
    "wealth": "Thiên thanh khoản, chấp nhận biến động. Rủi ro: không giữ đáy. Không hứa hiệu quả tài chính.",
    "relationships": "Giao tiếp theo vụ, ít cam kết dài. Cần nói rõ hạn; xung đột khi đối tác cần sổ Chính Tài.",
    "health": "Cân bằng hoạt/nghỉ: dễ thiên chạy việc. Cần điểm dừng. Không chẩn đoán.",
    "timing": "Hữu ích khi cửa sổ hẹp. Bất lợi khi pha đòi nuôi lâu.",
    "decision_making": "Thiên quyết theo cơ hội. Hữu ích khi cần xoay; bất lợi khi cần kỷ luật dài."
  },
  "recommendations": [
    {
      "category": "timing_awareness",
      "role": "useful_god",
      "action": "Xoay nguồn theo cửa sổ có hạn mức lỗ, không để thanh khoản thành không đáy.",
      "rationale": "Thiên Tài hữu dụng khi cơ động có bờ."
    },
    {
      "category": "balance_strategy",
      "role": "hy",
      "action": "Khi là Hỷ, dùng thanh khoản để phục vụ Dụng, không mở sới cơ hội riêng.",
      "rationale": "Hỷ thần không ngang Dụng thần."
    },
    {
      "category": "behavior",
      "role": "ky",
      "action": "Khi là Kỵ, giảm theo vụ và mở thêm kênh nguồn lúc nền đang cần ủ.",
      "rationale": "Cùng kênh tài cơ động hút sức nếu bị khuếch đại."
    }
  ],
  "warnings": [
    {
      "condition": "no_floor",
      "role": "useful_god",
      "risk": "Cơ động không đáy làm mất vốn nền.",
      "mitigation": "Giữ xoay; khóa hạn mức và điểm dừng."
    },
    {
      "condition": "reinforcement_when_ky",
      "role": "ky",
      "risk": "Gia cố Thiên Tài khi là Kỵ làm trượt nguồn và tranh ấn.",
      "mitigation": "Thu hẹp cửa sổ cơ hội, không cấm tuyệt linh hoạt."
    }
  ],
  "related_entities": [
    { "domain": "UsefulGod", "key": "Chính Tài" }
  ],
  "concept_ids": ["wealth_role", "drain_strong_day_master"],
  "evidence_notes": "Vai trò tài bất thường. Xuất hiện trong Hỷ của tòng tài và Kỵ của thân nhược (str_001, str_002). Knowledge giải thích chức năng. Không hardcode chart.",
  "metadata": {
    "author": "BTE Knowledge Team",
    "version": "1.0.0",
    "created": "2026-08-15",
    "updated": "2026-08-15",
    "status": "approved",
    "source": "knowledge/interpretation/domains/useful_god/thien_tai.json",
    "quality": "k2_1_production"
  }
}
