{
  "$schema": "../../schemas/knowledge_entity.schema.json",
  "id": "knowledge.useful_god.chinh_tai",
  "domain": "UsefulGod",
  "key": "Chính Tài",
  "entity_type": "role",
  "title": "Chính Tài — kênh vận hành nguồn có phép",
  "meaning": "Chính Tài là vai trò tài thuận: lưu thông nguồn theo trách nhiệm, đổi sức thành giá trị đều. Không phải nghĩa một can và không hứa giàu. Khi làm Dụng thần, hướng chính là vận hành nguồn có sổ. Khi thuộc Hỷ, hỗ trợ lưu thông theo Dụng. Khi thuộc Kỵ, cùng trách nhiệm nguồn thành gánh nặng, hút sức nhật chủ đang nhược.",
  "positive_meaning": "Là Dụng thần: giữ sổ, lưu thông, đổi công thành giá trị có kiểm soát. Là Hỷ thần: hỗ trợ vận hành — không thay Dụng.",
  "negative_meaning": "Là Kỵ thần hoặc dùng quá mức: ôm trách nhiệm tiền/việc quá sức, tính toán át dưỡng. Gia cố Chính Tài khi ấn đang cần nâng làm tranh sinh.",
  "applications": {
    "career": "Hợp môi trường có trách nhiệm nguồn, quy trình thu-chi rõ. Phong cách: sổ sách, cam kết. Không suy ra nghề kế toán hay buôn.",
    "wealth": "Thiên tích có kế hoạch, ít cược. Rủi ro: ôm nghĩa vụ tài chính quá nền. Không hứa hiệu quả tài chính.",
    "relationships": "Giao tiếp bằng cam kết vật chất/việc. Cần ranh nghĩa vụ; xung đột khi biến chu cấp thành kiểm soát.",
    "health": "Cân bằng hoạt/nghỉ: dễ thiên lo liệu. Cần nhịp không tính. Không chẩn đoán.",
    "decision_making": "Thiên quyết theo chi phí-lợi ích đều. Hữu ích khi cần lưu thông; bất lợi khi cần ủ ấn.",
    "environment": "Môi trường có trách nhiệm rõ. Hỗn nguồn đi ngược khi Chính Tài là Dụng."
  },
  "recommendations": [
    {
      "category": "balance_strategy",
      "role": "useful_god",
      "action": "Vận hành một dòng nguồn có hạn mức, không ôm mọi nghĩa vụ.",
      "rationale": "Chính Tài hữu dụng khi lưu thông có phép."
    },
    {
      "category": "skill_development",
      "role": "hy",
      "action": "Khi là Hỷ, dùng kỷ luật nguồn để phục vụ Dụng, không biến thành mục tiêu riêng.",
      "rationale": "Hỷ thần hỗ trợ hướng đã chọn."
    },
    {
      "category": "behavior",
      "role": "ky",
      "action": "Khi là Kỵ, giảm ôm thêm nghĩa vụ tiền/việc khi nền đang mỏng.",
      "rationale": "Cùng kênh tài hút sức nếu bị khuếch đại."
    }
  ],
  "warnings": [
    {
      "condition": "over_obligation",
      "role": "useful_god",
      "risk": "Trách nhiệm nguồn quá mức làm kiệt nhật chủ.",
      "mitigation": "Giữ sổ; cắt nghĩa vụ vượt nền."
    },
    {
      "condition": "reinforcement_when_ky",
      "role": "ky",
      "risk": "Gia cố Chính Tài khi là Kỵ làm tranh ấn và hút lực.",
      "mitigation": "Thu hẹp cam kết nguồn, không cấm tuyệt trách nhiệm."
    }
  ],
  "related_entities": [
    { "domain": "UsefulGod", "key": "Thiên Tài" }
  ],
  "concept_ids": ["wealth_role", "drain_strong_day_master"],
  "evidence_notes": "Vai trò tài thuận. Engine chọn Chính Tài ở str_005 (thân trung hòa) và spc_001 (tòng tài). Knowledge không đổi lựa chọn. Không hardcode case.",
  "metadata": {
    "author": "BTE Knowledge Team",
    "version": "1.0.0",
    "created": "2026-08-15",
    "updated": "2026-08-15",
    "status": "approved",
    "source": "knowledge/interpretation/domains/useful_god/chinh_tai.json",
    "quality": "k2_1_production"
  }
}
